{
  "$schema": "https://json-schema.org/draft/2020-12/schema",
  "$id": "https://agent-orchestrator/benchmarks/schemas/benchmark-suite.schema.json",
  "title": "BenchmarkSuite",
  "description": "Declarative benchmark suite spec for ao-bench (design doc §5.1). Instructions/fixtures are referenced by PATH, relative to this file; never inlined.",
  "type": "object",
  "additionalProperties": false,
  "required": ["version", "id", "domain", "tasks"],
  "properties": {
    "version": {
      "type": "string",
      "pattern": "^[0-9]+\\.[0-9]+$",
      "description": "Spec schema version, e.g. \"1.0\"."
    },
    "id": {
      "type": "string",
      "pattern": "^[a-z0-9][a-z0-9-_]*$",
      "description": "Lowercase kebab suite id, unique among committed suites."
    },
    "domain": {
      "type": "string",
      "minLength": 1,
      "description": "Free-string domain label (e.g. \"software\"); enables non-dev suites later without a schema change."
    },
    "description": { "type": "string", "default": "" },
    "tier": {
      "enum": ["small", "medium", "large", "xlarge"],
      "default": "small",
      "description": "Benchmark tier; drives per-tier budget/parallel/timeout defaults from benchmarks/tiers.json. Closed list enforced by the loader (bench/spec.py KNOWN_TIERS)."
    },
    "defaults": {
      "type": "object",
      "additionalProperties": false,
      "properties": {
        "timeout_seconds": { "type": "integer", "minimum": 1 }
      }
    },
    "tasks": {
      "type": "array",
      "minItems": 1,
      "items": { "$ref": "#/$defs/task" }
    },
    "parity": {
      "type": "string",
      "description": "PATH (relative to this suite.json) to a parity bundle dir/parity.json applied to every subject (bench/parity.py; HLD §2b)."
    },
    "stack": {
      "type": "object",
      "additionalProperties": true,
      "description": "Per-language sandbox image + dependency allow-list for generated tasks (bench/sandbox.py, bench/gen). Open: validated by the sandbox/generator."
    },
    "cutoff_date": {
      "type": "string",
      "description": "Tier 2a contamination control: ISO date; only PRs merged on/after it were mined."
    }
  },
  "$defs": {
    "task": {
      "type": "object",
      "additionalProperties": false,
      "required": ["id", "category", "instruction", "grader"],
      "properties": {
        "id": {
          "type": "string",
          "pattern": "^[a-z0-9][a-z0-9-_]*$",
          "description": "Lowercase kebab task id, unique within the suite."
        },
        "category": {
          "enum": ["bugfix", "feature", "refactor", "test", "other"]
        },
        "instruction": {
          "type": "string",
          "description": "PATH to a .md instruction file, relative to this suite.json. Never inline contents."
        },
        "fixture": {
          "type": "string",
          "description": "PATH to a tiny fixture repo dir, relative to this suite.json. Never inline contents. Optional when `source` is set instead; the loader (bench/spec.py) requires at least one of `fixture`/`source`."
        },
        "source": {
          "type": "object",
          "additionalProperties": true,
          "required": ["type"],
          "description": "Optional alternative to `fixture`: directs materialize_workspace (bench/workspace.py) to a non-default WorkspaceProvider, e.g. a SWE-bench repo checkout instead of a committed fixture copy.",
          "properties": {
            "type": {
              "type": "string",
              "description": "Workspace provider type key into WORKSPACE_PROVIDER_REGISTRY (e.g. \"fixture\", \"swebench\"). Closed list enforced by the loader (bench/spec.py KNOWN_WORKSPACE_PROVIDER_TYPES), not this schema, so new provider types can be added ahead of registry wiring without a schema edit. Provider-specific fields (e.g. swebench's instance_id/dataset/revision) are open here -- each provider validates its own fields."
            }
          }
        },
        "grader": { "$ref": "#/$defs/grader" },
        "timeout_seconds": { "type": "integer", "minimum": 1 },
        "tags": {
          "type": "array",
          "items": { "type": "string" },
          "default": []
        },
        "family": { "type": "string", "description": "Generator family (Tier 1) or task source family (Tier 2)." },
        "language": { "enum": ["python", "typescript", "go"] },
        "difficulty": {
          "type": "object",
          "additionalProperties": { "type": "integer", "minimum": 0 },
          "description": "Difficulty vector (HLD §4.1), e.g. entities/traps/concurrency/scale each 0-3."
        },
        "enabled": { "type": "boolean", "default": true, "description": "false = retired task; kept in git, never run." },
        "calibration": { "type": "object", "additionalProperties": true, "description": "Last `ao-bench calibrate` record for this task." }
      }
    },
    "grader": {
      "type": "object",
      "additionalProperties": true,
      "required": ["type"],
      "properties": {
        "type": {
          "type": "string",
          "description": "Grader type key into GRADER_REGISTRY (e.g. \"pytest\", \"command\", \"file_assertion\", \"fake\", \"blackbox\", \"pytest_targeted\"). Closed list enforced by the loader (bench/spec.py KNOWN_GRADER_TYPES), not this schema. Grader-specific fields are open here (additionalProperties) -- each grader validates its own, mirroring `source`."
        },
        "assets": {
          "type": "string",
          "description": "PATH (relative to this suite.json) to grader-owned, agent-hidden assets copied into the task's grading_dir (never under the agent-visible workspace)."
        },
        "command": {
          "type": "string",
          "description": "Command to run for pytest/command graders. Defaults are grader-type specific."
        },
        "cwd": {
          "type": "string",
          "description": "Working dir for the grader command, relative to the task's mutated repo."
        },
        "timeout_seconds": { "type": "integer", "minimum": 1 },
        "pass_threshold": {
          "type": "number",
          "minimum": 0,
          "maximum": 1,
          "description": "Minimum score (pass-rate) required to mark solved=true. Defaults to exit-code-only semantics when unset."
        },
        "assertions": {
          "type": "array",
          "items": { "$ref": "#/$defs/assertion" },
          "description": "file_assertion grader: checks evaluated against the mutated repo."
        }
      }
    },
    "assertion": {
      "type": "object",
      "additionalProperties": false,
      "required": ["type", "path"],
      "properties": {
        "type": { "enum": ["exists", "contains", "equals_file"] },
        "path": {
          "type": "string",
          "description": "PATH relative to the task's mutated repo, checked by this assertion."
        },
        "substring": {
          "type": "string",
          "description": "Required for type=contains: substring that must appear in `path`."
        },
        "golden": {
          "type": "string",
          "description": "Required for type=equals_file: PATH to a golden reference file, relative to this suite.json."
        }
      }
    }
  }
}
