{
  "version": "1.0",
  "id": "gen-calib-stair",
  "domain": "software",
  "description": "Generated behavioural-spec suite (Tier 1): each task is a seeded spec -> service build graded black-box by hidden probes (core / trap / perf). Generated by `ao-bench gen --out <suite dir> --id gen-calib-stair --family algo-staircase --count 3 --languages python --seed 52000 --difficulty entities=3,traps=1,concurrency=1,scale=1 --tier large --parity ../../parity/default`; see README.md. Probes and the reference implementation are not stored here: they are regenerated from the task's `source` at materialise time.",
  "tier": "large",
  "defaults": {
    "timeout_seconds": 3600
  },
  "parity": "../../parity/default",
  "stack": {
    "python": {
      "deps": [
        "montydb"
      ]
    }
  },
  "tasks": [
    {
      "id": "algo-staircase-py-s52000",
      "category": "feature",
      "instruction": "tasks/_generated/instruction-jsonl.md",
      "source": {
        "type": "generated",
        "family": "algo-staircase",
        "seed": 52000,
        "difficulty": {
          "entities": 3,
          "traps": 1,
          "concurrency": 1,
          "scale": 1
        },
        "language": "python",
        "deps": [
          "montydb"
        ]
      },
      "grader": {
        "type": "objective",
        "sandbox": {
          "stack": {
            "python": {
              "deps": [
                "montydb"
              ]
            }
          }
        }
      },
      "family": "algo-staircase",
      "language": "python",
      "difficulty": {
        "entities": 3,
        "traps": 1,
        "concurrency": 1,
        "scale": 1
      },
      "tags": [
        "generated",
        "algo-staircase",
        "python",
        "jsonl",
        "large"
      ]
    },
    {
      "id": "algo-staircase-py-s52001",
      "category": "feature",
      "instruction": "tasks/_generated/instruction-jsonl.md",
      "source": {
        "type": "generated",
        "family": "algo-staircase",
        "seed": 52001,
        "difficulty": {
          "entities": 3,
          "traps": 1,
          "concurrency": 1,
          "scale": 1
        },
        "language": "python",
        "deps": [
          "montydb"
        ]
      },
      "grader": {
        "type": "objective",
        "sandbox": {
          "stack": {
            "python": {
              "deps": [
                "montydb"
              ]
            }
          }
        }
      },
      "family": "algo-staircase",
      "language": "python",
      "difficulty": {
        "entities": 3,
        "traps": 1,
        "concurrency": 1,
        "scale": 1
      },
      "tags": [
        "generated",
        "algo-staircase",
        "python",
        "jsonl",
        "large"
      ]
    },
    {
      "id": "algo-staircase-py-s52002",
      "category": "feature",
      "instruction": "tasks/_generated/instruction-jsonl.md",
      "source": {
        "type": "generated",
        "family": "algo-staircase",
        "seed": 52002,
        "difficulty": {
          "entities": 3,
          "traps": 1,
          "concurrency": 1,
          "scale": 1
        },
        "language": "python",
        "deps": [
          "montydb"
        ]
      },
      "grader": {
        "type": "objective",
        "sandbox": {
          "stack": {
            "python": {
              "deps": [
                "montydb"
              ]
            }
          }
        }
      },
      "family": "algo-staircase",
      "language": "python",
      "difficulty": {
        "entities": 3,
        "traps": 1,
        "concurrency": 1,
        "scale": 1
      },
      "tags": [
        "generated",
        "algo-staircase",
        "python",
        "jsonl",
        "large"
      ]
    }
  ]
}
