{
  "version": "1.0",
  "id": "gen-calib-bh",
  "domain": "software",
  "description": "Generated behavioural-spec suite (Tier 1): each task is a seeded spec -> service build graded black-box by hidden probes (core / trap / perf). Generated by `ao-bench gen --out <suite dir> --id gen-calib-bh --family bug-hunt --count 2 --languages python --seed 7451 --difficulty entities=3,traps=2,concurrency=2,scale=1 --tier medium --parity ../../parity/default`; see README.md. Probes and the reference implementation are not stored here: they are regenerated from the task's `source` at materialise time.",
  "tier": "medium",
  "defaults": {
    "timeout_seconds": 3600
  },
  "parity": "../../parity/default",
  "stack": {
    "python": {
      "deps": [
        "montydb"
      ]
    }
  },
  "tasks": [
    {
      "id": "bug-hunt-py-s7451",
      "category": "feature",
      "instruction": "tasks/_generated/instruction-debug-jsonl.md",
      "source": {
        "type": "generated",
        "family": "bug-hunt",
        "seed": 7451,
        "difficulty": {
          "entities": 3,
          "traps": 2,
          "concurrency": 2,
          "scale": 1
        },
        "language": "python",
        "deps": [
          "montydb"
        ]
      },
      "grader": {
        "type": "blackbox",
        "sandbox": {
          "stack": {
            "python": {
              "deps": [
                "montydb"
              ]
            }
          }
        }
      },
      "family": "bug-hunt",
      "language": "python",
      "difficulty": {
        "entities": 3,
        "traps": 2,
        "concurrency": 2,
        "scale": 1
      },
      "tags": [
        "generated",
        "bug-hunt",
        "python",
        "jsonl",
        "medium"
      ]
    },
    {
      "id": "bug-hunt-py-s7452",
      "category": "feature",
      "instruction": "tasks/_generated/instruction-debug-jsonl.md",
      "source": {
        "type": "generated",
        "family": "bug-hunt",
        "seed": 7452,
        "difficulty": {
          "entities": 3,
          "traps": 2,
          "concurrency": 2,
          "scale": 1
        },
        "language": "python",
        "deps": [
          "montydb"
        ]
      },
      "grader": {
        "type": "blackbox",
        "sandbox": {
          "stack": {
            "python": {
              "deps": [
                "montydb"
              ]
            }
          }
        }
      },
      "family": "bug-hunt",
      "language": "python",
      "difficulty": {
        "entities": 3,
        "traps": 2,
        "concurrency": 2,
        "scale": 1
      },
      "tags": [
        "generated",
        "bug-hunt",
        "python",
        "jsonl",
        "medium"
      ]
    }
  ]
}
