{
  "version": "1.0",
  "id": "gen-services-mini",
  "domain": "software",
  "description": "Generated behavioural-spec suite (Tier 1): each task is a seeded spec -> service build graded black-box by hidden probes (core / trap / perf). Generated by `ao-bench gen --out <suite dir> --id gen-services-mini --family crud-relational --family job-queue --count 1 --languages python --seed 4242 --difficulty entities=2,traps=2,concurrency=1,scale=1 --tier medium --parity ../../parity/default`; see README.md. Probes and the reference implementation are not stored here: they are regenerated from the task's `source` at materialise time.",
  "tier": "medium",
  "defaults": {
    "timeout_seconds": 3600
  },
  "parity": "../../parity/default",
  "stack": {
    "python": {
      "deps": [
        "montydb"
      ]
    }
  },
  "tasks": [
    {
      "id": "crud-relational-py-s4242",
      "category": "feature",
      "instruction": "tasks/_generated/instruction-http.md",
      "source": {
        "type": "generated",
        "family": "crud-relational",
        "seed": 4242,
        "difficulty": {
          "entities": 2,
          "traps": 2,
          "concurrency": 1,
          "scale": 1
        },
        "language": "python",
        "deps": [
          "montydb"
        ]
      },
      "grader": {
        "type": "blackbox",
        "sandbox": {
          "stack": {
            "python": {
              "deps": [
                "montydb"
              ]
            }
          }
        }
      },
      "family": "crud-relational",
      "language": "python",
      "difficulty": {
        "entities": 2,
        "traps": 2,
        "concurrency": 1,
        "scale": 1
      },
      "tags": [
        "generated",
        "crud-relational",
        "python",
        "http",
        "medium"
      ]
    },
    {
      "id": "job-queue-py-s4242",
      "category": "feature",
      "instruction": "tasks/_generated/instruction-jsonl.md",
      "source": {
        "type": "generated",
        "family": "job-queue",
        "seed": 4242,
        "difficulty": {
          "entities": 2,
          "traps": 2,
          "concurrency": 1,
          "scale": 1
        },
        "language": "python",
        "deps": [
          "montydb"
        ]
      },
      "grader": {
        "type": "blackbox",
        "sandbox": {
          "stack": {
            "python": {
              "deps": [
                "montydb"
              ]
            }
          }
        }
      },
      "family": "job-queue",
      "language": "python",
      "difficulty": {
        "entities": 2,
        "traps": 2,
        "concurrency": 1,
        "scale": 1
      },
      "tags": [
        "generated",
        "job-queue",
        "python",
        "jsonl",
        "medium"
      ]
    }
  ]
}
