{
  "version": "1.0",
  "id": "dev-medium",
  "domain": "software",
  "tier": "medium",
  "description": "Self-authored medium-tier dev-task suite (E-Bt4Xk9 / T-Md7Vc3): 6 genuinely longer (30-90 min of agent work), multi-file, stdlib-only Python fixtures, each graded by a held-out harness (tasks/<id>/grading/, copied into the run's agent-hidden grading_dir) beyond the visible tests/ suite, designed so a single trivial `claude -p` turn is not expected to ace every task. NOTE 2026-10-23: the held-out harness moved out of fixture/.grading/ (agent-readable) into grader-owned tasks/<id>/grading/ and the grader command changed, so every task's config_fingerprint changed on that date -- results recorded before it are not comparable run-for-run with results after it.",
  "defaults": { "timeout_seconds": 3600 },
  "tasks": [
    {
      "id": "feature-plugin-priority-registry",
      "category": "feature",
      "instruction": "tasks/feature-plugin-priority-registry/instruction.md",
      "fixture": "tasks/feature-plugin-priority-registry/fixture",
      "grader": {
        "type": "command",
        "assets": "tasks/feature-plugin-priority-registry/grading",
        "command": "uv run python {grading_dir}/run.py --repo {repo_dir}",
        "cwd": "."
      },
      "tags": ["python", "medium", "multi-file", "~30-45min"]
    },
    {
      "id": "refactor-money-cents",
      "category": "refactor",
      "instruction": "tasks/refactor-money-cents/instruction.md",
      "fixture": "tasks/refactor-money-cents/fixture",
      "grader": {
        "type": "command",
        "assets": "tasks/refactor-money-cents/grading",
        "command": "uv run python {grading_dir}/run.py --repo {repo_dir}",
        "cwd": "."
      },
      "tags": ["python", "medium", "multi-file", "~45-60min"]
    },
    {
      "id": "bugfix-cache-key-collision",
      "category": "bugfix",
      "instruction": "tasks/bugfix-cache-key-collision/instruction.md",
      "fixture": "tasks/bugfix-cache-key-collision/fixture",
      "grader": {
        "type": "command",
        "assets": "tasks/bugfix-cache-key-collision/grading",
        "command": "uv run python {grading_dir}/run.py --repo {repo_dir}",
        "cwd": "."
      },
      "tags": ["python", "medium", "multi-file", "misleading-symptom", "~45-90min"]
    },
    {
      "id": "feature-tracker-priority-filter",
      "category": "feature",
      "instruction": "tasks/feature-tracker-priority-filter/instruction.md",
      "fixture": "tasks/feature-tracker-priority-filter/fixture",
      "grader": {
        "type": "command",
        "assets": "tasks/feature-tracker-priority-filter/grading",
        "command": "uv run python {grading_dir}/run.py --repo {repo_dir}",
        "cwd": "."
      },
      "tags": ["python", "medium", "multi-file", "integration-point", "~45-60min"]
    },
    {
      "id": "bugfix-search-index-scan-budget",
      "category": "bugfix",
      "instruction": "tasks/bugfix-search-index-scan-budget/instruction.md",
      "fixture": "tasks/bugfix-search-index-scan-budget/fixture",
      "grader": {
        "type": "command",
        "assets": "tasks/bugfix-search-index-scan-budget/grading",
        "command": "uv run python {grading_dir}/run.py --repo {repo_dir}",
        "cwd": "."
      },
      "tags": ["python", "medium", "multi-file", "performance-correctness", "~45-60min"]
    },
    {
      "id": "test-write-validation-spec",
      "category": "test",
      "instruction": "tasks/test-write-validation-spec/instruction.md",
      "fixture": "tasks/test-write-validation-spec/fixture",
      "grader": {
        "type": "command",
        "assets": "tasks/test-write-validation-spec/grading",
        "command": "uv run python {grading_dir}/run.py --repo {repo_dir}",
        "cwd": "."
      },
      "tags": ["python", "medium", "test-writing", "mutation-check", "~30-45min"]
    }
  ]
}
