{
  "version": "1.0",
  "id": "gen-calib-arena",
  "domain": "software",
  "description": "Generated behavioural-spec suite (Tier 1): each task is a seeded spec -> service build graded black-box by hidden probes (core / trap / perf). Generated by `ao-bench gen --out <suite dir> --id gen-calib-arena --family game-arena --count 3 --languages python --seed 43000 --difficulty entities=2,traps=0,concurrency=1,scale=0 --tier large --parity ../../parity/default`; see README.md. Probes and the reference implementation are not stored here: they are regenerated from the task's `source` at materialise time.",
  "tier": "large",
  "defaults": {
    "timeout_seconds": 3600
  },
  "parity": "../../parity/default",
  "stack": {
    "python": {
      "deps": [
        "montydb"
      ]
    }
  },
  "tasks": [
    {
      "id": "game-arena-py-s43000",
      "category": "feature",
      "instruction": "tasks/_generated/instruction-arena-jsonl.md",
      "source": {
        "type": "generated",
        "family": "game-arena",
        "seed": 43000,
        "difficulty": {
          "entities": 2,
          "traps": 0,
          "concurrency": 1,
          "scale": 0
        },
        "language": "python",
        "deps": [
          "montydb"
        ]
      },
      "grader": {
        "type": "arena",
        "sandbox": {
          "stack": {
            "python": {
              "deps": [
                "montydb"
              ]
            }
          }
        }
      },
      "family": "game-arena",
      "language": "python",
      "difficulty": {
        "entities": 2,
        "traps": 0,
        "concurrency": 1,
        "scale": 0
      },
      "tags": [
        "generated",
        "game-arena",
        "python",
        "jsonl",
        "large"
      ]
    },
    {
      "id": "game-arena-py-s43001",
      "category": "feature",
      "instruction": "tasks/_generated/instruction-arena-jsonl.md",
      "source": {
        "type": "generated",
        "family": "game-arena",
        "seed": 43001,
        "difficulty": {
          "entities": 2,
          "traps": 0,
          "concurrency": 1,
          "scale": 0
        },
        "language": "python",
        "deps": [
          "montydb"
        ]
      },
      "grader": {
        "type": "arena",
        "sandbox": {
          "stack": {
            "python": {
              "deps": [
                "montydb"
              ]
            }
          }
        }
      },
      "family": "game-arena",
      "language": "python",
      "difficulty": {
        "entities": 2,
        "traps": 0,
        "concurrency": 1,
        "scale": 0
      },
      "tags": [
        "generated",
        "game-arena",
        "python",
        "jsonl",
        "large"
      ]
    },
    {
      "id": "game-arena-py-s43002",
      "category": "feature",
      "instruction": "tasks/_generated/instruction-arena-jsonl.md",
      "source": {
        "type": "generated",
        "family": "game-arena",
        "seed": 43002,
        "difficulty": {
          "entities": 2,
          "traps": 0,
          "concurrency": 1,
          "scale": 0
        },
        "language": "python",
        "deps": [
          "montydb"
        ]
      },
      "grader": {
        "type": "arena",
        "sandbox": {
          "stack": {
            "python": {
              "deps": [
                "montydb"
              ]
            }
          }
        }
      },
      "family": "game-arena",
      "language": "python",
      "difficulty": {
        "entities": 2,
        "traps": 0,
        "concurrency": 1,
        "scale": 0
      },
      "tags": [
        "generated",
        "game-arena",
        "python",
        "jsonl",
        "large"
      ]
    }
  ]
}
