{
  "version": "1.0",
  "id": "gen-calib-opt",
  "domain": "software",
  "description": "Generated behavioural-spec suite (Tier 1): each task is a seeded spec -> service build graded black-box by hidden probes (core / trap / perf). Generated by `ao-bench gen --out <suite dir> --id gen-calib-opt --family opt-ladder --count 3 --languages python --seed 41000 --difficulty entities=2,traps=1,concurrency=1,scale=2 --tier large --parity ../../parity/default`; see README.md. Probes and the reference implementation are not stored here: they are regenerated from the task's `source` at materialise time.",
  "tier": "large",
  "defaults": {
    "timeout_seconds": 3600
  },
  "parity": "../../parity/default",
  "stack": {
    "python": {
      "deps": [
        "montydb"
      ]
    }
  },
  "tasks": [
    {
      "id": "opt-ladder-py-s41000",
      "category": "feature",
      "instruction": "tasks/_generated/instruction-optimize-jsonl.md",
      "source": {
        "type": "generated",
        "family": "opt-ladder",
        "seed": 41000,
        "difficulty": {
          "entities": 2,
          "traps": 1,
          "concurrency": 1,
          "scale": 2
        },
        "language": "python",
        "deps": [
          "montydb"
        ]
      },
      "grader": {
        "type": "objective",
        "sandbox": {
          "stack": {
            "python": {
              "deps": [
                "montydb"
              ]
            }
          }
        }
      },
      "family": "opt-ladder",
      "language": "python",
      "difficulty": {
        "entities": 2,
        "traps": 1,
        "concurrency": 1,
        "scale": 2
      },
      "tags": [
        "generated",
        "opt-ladder",
        "python",
        "jsonl",
        "large"
      ]
    },
    {
      "id": "opt-ladder-py-s41001",
      "category": "feature",
      "instruction": "tasks/_generated/instruction-optimize-jsonl.md",
      "source": {
        "type": "generated",
        "family": "opt-ladder",
        "seed": 41001,
        "difficulty": {
          "entities": 2,
          "traps": 1,
          "concurrency": 1,
          "scale": 2
        },
        "language": "python",
        "deps": [
          "montydb"
        ]
      },
      "grader": {
        "type": "objective",
        "sandbox": {
          "stack": {
            "python": {
              "deps": [
                "montydb"
              ]
            }
          }
        }
      },
      "family": "opt-ladder",
      "language": "python",
      "difficulty": {
        "entities": 2,
        "traps": 1,
        "concurrency": 1,
        "scale": 2
      },
      "tags": [
        "generated",
        "opt-ladder",
        "python",
        "jsonl",
        "large"
      ]
    },
    {
      "id": "opt-ladder-py-s41002",
      "category": "feature",
      "instruction": "tasks/_generated/instruction-optimize-jsonl.md",
      "source": {
        "type": "generated",
        "family": "opt-ladder",
        "seed": 41002,
        "difficulty": {
          "entities": 2,
          "traps": 1,
          "concurrency": 1,
          "scale": 2
        },
        "language": "python",
        "deps": [
          "montydb"
        ]
      },
      "grader": {
        "type": "objective",
        "sandbox": {
          "stack": {
            "python": {
              "deps": [
                "montydb"
              ]
            }
          }
        }
      },
      "family": "opt-ladder",
      "language": "python",
      "difficulty": {
        "entities": 2,
        "traps": 1,
        "concurrency": 1,
        "scale": 2
      },
      "tags": [
        "generated",
        "opt-ladder",
        "python",
        "jsonl",
        "large"
      ]
    }
  ]
}
