{
  "version": "1.0",
  "id": "gen-calib-ah",
  "domain": "software",
  "description": "Generated behavioural-spec suite (Tier 1): each task is a seeded spec -> service build graded black-box by hidden probes (core / trap / perf). Generated by `ao-bench gen --out <suite dir> --id gen-calib-ah --family algo-hard --count 2 --languages python --seed 7601 --difficulty entities=3,traps=3,concurrency=2,scale=3 --tier medium --parity ../../parity/default`; see README.md. Probes and the reference implementation are not stored here: they are regenerated from the task's `source` at materialise time.",
  "tier": "medium",
  "defaults": {
    "timeout_seconds": 3600
  },
  "parity": "../../parity/default",
  "stack": {
    "python": {
      "deps": [
        "montydb"
      ]
    }
  },
  "tasks": [
    {
      "id": "algo-hard-py-s7601",
      "category": "feature",
      "instruction": "tasks/_generated/instruction-jsonl.md",
      "source": {
        "type": "generated",
        "family": "algo-hard",
        "seed": 7601,
        "difficulty": {
          "entities": 3,
          "traps": 3,
          "concurrency": 2,
          "scale": 3
        },
        "language": "python",
        "deps": [
          "montydb"
        ]
      },
      "grader": {
        "type": "blackbox",
        "sandbox": {
          "stack": {
            "python": {
              "deps": [
                "montydb"
              ]
            }
          }
        }
      },
      "family": "algo-hard",
      "language": "python",
      "difficulty": {
        "entities": 3,
        "traps": 3,
        "concurrency": 2,
        "scale": 3
      },
      "tags": [
        "generated",
        "algo-hard",
        "python",
        "jsonl",
        "medium"
      ]
    },
    {
      "id": "algo-hard-py-s7602",
      "category": "feature",
      "instruction": "tasks/_generated/instruction-jsonl.md",
      "source": {
        "type": "generated",
        "family": "algo-hard",
        "seed": 7602,
        "difficulty": {
          "entities": 3,
          "traps": 3,
          "concurrency": 2,
          "scale": 3
        },
        "language": "python",
        "deps": [
          "montydb"
        ]
      },
      "grader": {
        "type": "blackbox",
        "sandbox": {
          "stack": {
            "python": {
              "deps": [
                "montydb"
              ]
            }
          }
        }
      },
      "family": "algo-hard",
      "language": "python",
      "difficulty": {
        "entities": 3,
        "traps": 3,
        "concurrency": 2,
        "scale": 3
      },
      "tags": [
        "generated",
        "algo-hard",
        "python",
        "jsonl",
        "medium"
      ]
    }
  ]
}
